ID,artist_id,title,picture_data,file_info,jpg url
475,"ALGARDI, Alessandro",cardinal laudivio zacchia,"1626, marble, staatliche museen, berlin","1785*2100, true color, 235 kb",images/artworks/475.jpg
476,"ALGARDI, Alessandro",bust of donna olimpia maidalchini,"1646-47, marble, height 70 cm, galleria doria pamphilj, rome","1383*2100, true color, 248 kb",images/artworks/476.jpg
477,"ALGARDI, Alessandro",monument of odoardo santarelli,"c. 1640, marble, santa maria maggiore, rome","1700*1649, true color, 284 kb",images/artworks/477.jpg
478,"ALGARDI, Alessandro",tomb of giovanni savenier and his cousin,"1638, marble, santa maria dell'anima, rome","1600*1200, true color, 178 kb",images/artworks/478.jpg
479,"ALGARDI, Alessandro",cardinal laudivio zacchia (detail),"1626, marble, staatliche museen, berlin","600*800, true color, 111 kb",images/artworks/479.jpg
480,"ALGARDI, Alessandro","monuments to muzio, roberto and lelio frangipane","1630-38, marble, san marcello al corso, rome","900*641, true color, 137 kb",images/artworks/480.jpg
481,"ALGARDI, Alessandro",bust of a saint,"1650s, bronze, santi vittore e carlo, genoa","1253*1600, true color, 241 kb",images/artworks/481.jpg
482,"ALGARDI, Alessandro",bust of a saint,"1650s, bronze, santi vittore e carlo, genoa","1216*1600, true color, 205 kb",images/artworks/482.jpg
483,"ALGARDI, Alessandro",bust of cardinal paolo emilio zacchia,"c. 1650, terracotta, height 83 cm, victoria and albert museum, london","1769*1900, true color, 293 kb",images/artworks/483.jpg
484,"ALGARDI, Alessandro",st john the evangelist,"1640-50, bronze, height 70 cm, santi vittore e carlo, genoa","674*885, grayscale, 92 kb",images/artworks/484.jpg
485,"ALGARDI, Alessandro",bust of a saint,"1650s, bronze, santi vittore e carlo, genoa","1368*1800, true color, 174 kb",images/artworks/485.jpg
486,"ALGARDI, Alessandro",bust of a saint,"1650s, bronze, santi vittore e carlo, genoa","1091*1900, true color, 185 kb",images/artworks/486.jpg
487,"ALGARDI, Alessandro",bust of a saint,"1650s, bronze, santi vittore e carlo, genoa","1273*1600, true color, 253 kb",images/artworks/487.jpg
488,"ALGARDI, Alessandro",bust of roberto frangipane,"1630-38, marble, san marcello al corso, rome","1486*1900, true color, 307 kb",images/artworks/488.jpg
489,"ALGARDI, Alessandro",bust of muzio frangipane,"1630-38, marble, san marcello al corso, rome","1364*1900, true color, 222 kb",images/artworks/489.jpg
490,"ALGARDI, Alessandro",bust of lelio frangipane,"1630-38, marble, san marcello al corso, rome","1572*1900, true color, 245 kb",images/artworks/490.jpg
491,"ALGARDI, Alessandro",tomb of giacomo franzone,"1650s, marble, santi vittore e carlo, genoa","1200*1600, true color, 278 kb",images/artworks/491.jpg
492,"ALGARDI, Alessandro",monument of pope leo xi,"1634-44, marble, basilica di san pietro, vatican","900*1313, true color, 219 kb",images/artworks/492.jpg
493,"ALINCBROT, Louis",scenes from the life of christ,"1440s, oil on panel, 78 x 67 cm, museo del prado, madrid","950*1058, true color, 207 kb",images/artworks/493.jpg
494,"ALLAR, André-Joseph",the goodbyes of alcestis,"-, white marble, 72 x 66 cm, private collection","1000*1049, true color, 119 kb",images/artworks/494.jpg
495,"ALLAR, André-Joseph",the goodbyes of alcestis,"-, white marble, 72 x 66 cm, private collection","638*803, true color, 101 kb",images/artworks/495.jpg
496,"ALLAR, André-Joseph",the goodbyes of alcestis (detail),"-, white marble, private collection","811*1079, true color, 121 kb",images/artworks/496.jpg
497,"ALLAR, André-Joseph",the death of alcestis,"1881, marble, 165 x 100 x 150 cm, jardin de l'éveché, lisieux","730*1000, true color, 72 kb",images/artworks/497.jpg
498,"ALLAR, André-Joseph",child from abruzzo,"1883, bronze, height 128 cm, musée d'orsay, paris","670*900, true color, 40 kb",images/artworks/498.jpg
499,"ALLAR, André-Joseph",pierre guillaume frédéric le play,"1906, bronze, jardin du luxembourg, paris","1000*1333, true color, 182 kb",images/artworks/499.jpg
